id,caption,media_type,media_url,permalink,thumbnail_url,timestamp
18058191346801119,"Conheça alguns dos compositores que, através de suas vidas e obras, quebraram barreiras e trouxeram novas perspectivas à música erudita. 

Cada composição pode ser percebida como um reflexo de suas lutas e vivências. 

#MARFIMDuo #MusicaErudita #LGBTQIA #DiversidadeNaMusica #Piano #Violoncelo #LeiPauloGustavoSP #tudoviracultsp",CAROUSEL_ALBUM,https://scontent.cdninstagram.com/v/t51.29350-15/462593092_548774100996731_2722163753344897971_n.webp?stp=dst-jpg_e35_tt6&_nc_cat=100&ccb=1-7&_nc_sid=18de74&_nc_ohc=DgGl1PAy_CwQ7kNvgHGGWxQ&_nc_oc=AdhhLO0XtzXkd3Gt_kBj3EV4KjUSvJeltiGBc9qSJzIIe8lzn6k3rWwggqI-i8wLTOtP1jBxPEoMo2eeGk-ZkZEz&_nc_zt=23&_nc_ht=scontent.cdninstagram.com&edm=ANo9K5cEAAAA&_nc_gid=AnBqdYMzoXr8ZLMYvcndu7o&oh=00_AYAcSUjbKe7Fix92uDlmUHk5qNJSZj8CA5xJWHvyXLK5yA&oe=6769A718,https://www.instagram.com/p/DA6g_lpJV3p/,,2024-10-09T18:58:57+0000
18048283375777255,"Tendo como base uma pesquisa cuidadosa realizada por Gabriel Fabiano, o espetáculo de MARFIM conta com compositores e compositoras de diversos períodos e nacionalidades da história da música de concerto.

Cada uma das obras é escolhida por melhor representar a musicalidade de seu autor ou autora dentro da instrumentação de violoncelo e piano.

#MARFIM #DuoMarfim #SãoCarlos #MúsicaContemporânea #MúsicaClassica #MúsicaDeCâmara #LGBTQIA #DirecaoArtistica #DiversidadeCultural #CulturaTransforma #musicaclassica #projetocultural #saocarlos #cultura #SãoCarlosCultura #LeiPauloGustavoSP #tudoviracultsp",CAROUSEL_ALBUM,https://scontent.cdninstagram.com/v/t51.29350-15/462073849_1080074330348990_6310223760290707017_n.webp?stp=dst-jpg_e35_tt6&_nc_cat=104&ccb=1-7&_nc_sid=18de74&_nc_ohc=Ys4AZbHAZu8Q7kNvgF7u3CN&_nc_oc=Adj0ZKEnRTSr5vqLXcJ-9xVarsCRGDmlVD0PwQD1ik3H2ZCGlxH8q2Pc1c4ZYp3kHzmZ_xxjwlJFuL3TjDG7t1HU&_nc_zt=23&_nc_ht=scontent.cdninstagram.com&edm=ANo9K5cEAAAA&_nc_gid=AnBqdYMzoXr8ZLMYvcndu7o&oh=00_AYAd9_QT12BEXy9t9OlyEIA2LbQIQaIVQ-8szvUQha9Y0A&oe=6769D806,https://www.instagram.com/p/DAtt1vNhmqv/,,2024-10-04T19:41:04+0000
17898706296052822,,VIDEO,https://instagram.fcgh68-1.fna.fbcdn.net/o1/v/t16/f2/m86/AQMMDmF6vA5RibvEpp4I7fH5J9WMwAbJr0qKRLZHgtyq17rtQb6Xti4V_JPQrgMn-rE3-JaJbMXbFsPQnUmDCEl8U_Z0N5VO-5WHMDE.mp4?efg=eyJ4cHZfYXNzZXRfaWQiOjUxNTA0MTc0Nzk0MTIzMCwidmVuY29kZV90YWciOiJ4cHZfcHJvZ3Jlc3NpdmUuSU5TVEFHUkFNLkNMSVBTLkMzLjcyMC5kYXNoX2Jhc2VsaW5lXzFfdjEifQ&_nc_ht=instagram.fcgh68-1.fna.fbcdn.net&_nc_cat=101&_nc_oc=Adj11kH4V_HvYzkKHGQwqjki9Y99fBA5j34bplghUJWQZNDy78zDe_hMmKsezRLBvs_ykjRac-vA643rgMIod2RB&vs=d7477bb265fce43f&_nc_vs=HBksFQIYUmlnX3hwdl9yZWVsc19wZXJtYW5lbnRfc3JfcHJvZC83OTQwMjU2MTIzQTgxMzU5NjM1OEQ0RDNDQjc5OTA4QV92aWRlb19kYXNoaW5pdC5tcDQVAALIAQAVAhg6cGFzc3Rocm91Z2hfZXZlcnN0b3JlL0dHZnZjaHZJYmpKcGp0VURBRGtTNVlnWmM3Y2ZicV9FQUFBRhUCAsgBACgAGAAbAogHdXNlX29pbAExEnByb2dyZXNzaXZlX3JlY2lwZQExFQAAJtzd8Yawm-oBFQIoAkMzLBdAPWVgQYk3TBgSZGFzaF9iYXNlbGluZV8xX3YxEQB1_gcA&ccb=9-4&oh=00_AYBWHX4BGdOEmqLV7OS53fAFP9prtFqG2H0YiKGyyw0DpA&oe=6765B45A&_nc_sid=1d576d,https://www.instagram.com/reel/DAHYPh1AOhH/,https://scontent.cdninstagram.com/v/t51.29350-15/460503769_565106552735504_8783447626200041214_n.jpg?stp=dst-jpg_e35_tt6&_nc_cat=101&ccb=1-7&_nc_sid=18de74&_nc_ohc=jxu-HDrrVP8Q7kNvgGIsoKK&_nc_oc=AdiRUV4mvaMFLRUhq5uTELfAE_hfIWBKX_yCczOTVhQobfnl-wTb4gb4fUO_DkUoNIzU-qtu3kWcRhX3T5soKX6w&_nc_zt=23&_nc_ht=scontent.cdninstagram.com&edm=ANo9K5cEAAAA&_nc_gid=AnBqdYMzoXr8ZLMYvcndu7o&oh=00_AYCghjaGkdTGbl4mwgF7atQbUbBtLk8q3voIPhDHDF5AAA&oe=6769D0A1,2024-09-19T22:23:24+0000
17903851578022859,"🎶 MARFIM ao vivo no Centro Suzuki! 🎶

No dia 20 de setembro, às 20h, venha se encantar com o espetáculo único do duo Gabriel Fabiano e Marcelo Aquino, no Centro Suzuki em São Carlos! 🌟

Prepare-se para uma noite especial, com um repertório que celebra a música clássica sob a ótica LGBTQIA+, apresentando obras de grandes compositores como Tchaikovsky, Saint-Saëns, e muitos outros.

📍 Endereço: Rua Bruno Giongo, 3411 - Vila Deriggi, São Carlos.
🎫 Ingressos limitados! Garanta o seu pelo link na bio.

Não perca essa oportunidade de vivenciar a música de maneira profunda e inovadora. Te esperamos!

#ShowMarfim #CulturaLGBTQIA #MúsicaClássica #CentroSuzuki #SãoCarlosCultura #MúsicaDeCâmara #LeiPauloGustavoSP #tudoviracultsp",IMAGE,https://scontent.cdninstagram.com/v/t51.29350-15/460307636_1297681801196601_2745731533954860246_n.heic?stp=dst-jpg_e35_tt6&_nc_cat=106&ccb=1-7&_nc_sid=18de74&_nc_ohc=O4bsZWRn6KwQ7kNvgEDZ2nS&_nc_oc=AdgPXlk9N962-BcBVqkVVHl0FXpjKQO2pEp6FHuWZJwwF4dDNNgxQlnQ5JgSXNBejIXoMWM4dyKGoijkn--jzjyi&_nc_zt=23&_nc_ht=scontent.cdninstagram.com&edm=ANo9K5cEAAAA&_nc_gid=AnBqdYMzoXr8ZLMYvcndu7o&oh=00_AYBLyy7fV7IioBjYZ6ynMjOPYeazz-wg5ojRLbV9bFWW7g&oe=6769A40F,https://www.instagram.com/p/DAE0Nx1gNJB/,,2024-09-18T22:27:55+0000
18004579970642230,"O projeto MARFIM se fundamenta em uma pesquisa dedicada à exploração e valorização de compositores LGBTQIA+ na música erudita. 

Através de uma abordagem crítica, buscamos recontextualizar peças clássicas, destacando as histórias e experiências que muitas vezes foram invisibilizadas no cânone musical. 

Nosso objetivo é não apenas executar essas obras, mas também contribuir para uma maior compreensão e valorização da diversidade na música clássica.

Acompanhe o trabalho de MARFIM e descubra como a música erudita pode ser um espaço de expressão e inclusão.

#MARFIMDuo #MusicaErudita #LGBTQIA #DiversidadeNaMusica #Piano #Violoncelo #leipaulogustavosp #tudoviracultsp",CAROUSEL_ALBUM,https://scontent.cdninstagram.com/v/t51.29350-15/459344443_822379173069545_9079568827104870662_n.heic?stp=dst-jpg_e35_tt6&_nc_cat=103&ccb=1-7&_nc_sid=18de74&_nc_ohc=5ZTEhu1hKPkQ7kNvgGJ95jV&_nc_oc=AdjkdEsvVY3uvygNMkMrrJlZTCAvAgBUaJP0ZCGnKC_9i7cpmA11-ystzijvEpE5YnGNCWB1ZpNYOGJnC-C6NdEJ&_nc_zt=23&_nc_ht=scontent.cdninstagram.com&edm=ANo9K5cEAAAA&_nc_gid=AnBqdYMzoXr8ZLMYvcndu7o&oh=00_AYCbLt_YCCbiAzc62XlK8pETOIu0T4SA0KpCnwGNlofJmg&oe=6769A62A,https://www.instagram.com/p/C_y9uJRgJH_/,,2024-09-12T00:04:39+0000
18004165832544332,"✨ Um Vislumbre do MARFIM (Parte 2) ✨

Semana passada, compartilhamos um vídeo de making of desse dia inesquecível!

Hoje, apresentamos mais fotos impressionantes do ensaio fotográfico, clicadas pelo talentoso @leoleoleomenezes 📸

Agradecemos a todos os amigos e seguidores que acompanham nosso trabalho! A participação e o apoio de vocês nos inspiram a seguir adiante. 🎶💙

Continuem comentando e compartilhando para nos ajudar a chegar ainda mais longe! 

E para quem ainda não viu, o vídeo de making of está na nossa postagem anterior. Confiram! ✨🎥

#APONTE #MARFIM #Fotografia #Photography #DuoMarfim #SãoCarlos #MúsicaContempoânea #Bastidores #DiversidadeCultural #musicaclassica #ufscar #saocarlos #sanca #cultura #composers #projetocultural",CAROUSEL_ALBUM,https://scontent.cdninstagram.com/v/t51.29350-15/448419717_835077194649464_6179832126870488200_n.heic?stp=dst-jpg_e35_tt6&_nc_cat=102&ccb=1-7&_nc_sid=18de74&_nc_ohc=UVgoQwyn0X0Q7kNvgEjquHY&_nc_oc=Adi7l9M9KhdG08UF-dQT9v7hejMqh4_zwX0x3C0eHPfjoOZ28Y85wLyyED5mcYUuABiHIlwuNSEYkJF-4FLeQ2yf&_nc_zt=23&_nc_ht=scontent.cdninstagram.com&edm=ANo9K5cEAAAA&_nc_gid=AnBqdYMzoXr8ZLMYvcndu7o&oh=00_AYD8Uxilbf1jb-x33svRg1nK1YhBmTzjC_trlSLAHtyJDg&oe=6769BFAE,https://www.instagram.com/p/C8SxQ-FglUJ/,,2024-06-16T22:25:56+0000
18020944454206428,"📸✨ Making Of: Ensaio Fotográfico do Duo MARFIM 

Como prometido, estamos felizes em compartilhar com vocês os bastidores do nosso último ensaio fotográfico!

Confira de perto como o talentoso @leoleoleomenezes capturou a identidade e a proposta artística do nosso duo através de suas lentes.

👉 Não perca! Em breve, vamos postar mais fotos incríveis desse ensaio. Fique ligado e acompanhe cada momento com a gente!

❤️ Curta, comente e compartilhe para que mais pessoas conheçam nosso projeto!

#APONTE #MARFIM #Bastidores #Fotografia #DuoMarfim #MakingOf #SãoCarlos #MúsicaContempoânea #Bastidores #DiversidadeCultural #musicaclassica #ufscar #saocarlos #sanca #cultura #composers #projetocultural #leipaulogustavosp #tudoviracultsp",VIDEO,https://instagram.fcgh68-1.fna.fbcdn.net/o1/v/t16/f2/m82/AQOySNDYkEf9ooWGIsUw1B_0VS3LGdyCwu0MK1bRcg8T5Mv9Jy9tmAIGygYKPuDDzHI72GmFQQqFBFPfAGTqrYS5Q64L-npp_xkxWJ8.mp4?efg=eyJ4cHZfYXNzZXRfaWQiOjc3Mjg3OTQ5MTM4NjkxMDEsInZlbmNvZGVfdGFnIjoieHB2X3Byb2dyZXNzaXZlLklOU1RBR1JBTS5DTElQUy5DMy43MjAuZGFzaF9iYXNlbGluZV8xX3YxIn0&_nc_ht=instagram.fcgh68-1.fna.fbcdn.net&_nc_cat=100&_nc_oc=Adix5WA7OX0nw_2d77drB1b8v2mBuCW8RspLh6bieLAxjKj0pqTU-MfXisRXxpe9m64cXMBbnnRzad8ZSrnx-Jzq&vs=67cbd7872c9a12d5&_nc_vs=HBksFQIYT2lnX3hwdl9yZWVsc19wZXJtYW5lbnRfcHJvZC9EMzQ1NTAxRjIyRDhFRTJEMzUyNDBGNjNGNzRFRDE4Ml92aWRlb19kYXNoaW5pdC5tcDQVAALIAQAVAhg6cGFzc3Rocm91Z2hfZXZlcnN0b3JlL0dQNGp0aG9hUEZQZXE4OENBT1hIX3BHdkV4TTJicV9FQUFBRhUCAsgBACgAGAAbAogHdXNlX29pbAExEnByb2dyZXNzaXZlX3JlY2lwZQExFQAAJtq0kLaJ07obFQIoAkMzLBdAUSRaHKwIMRgSZGFzaF9iYXNlbGluZV8xX3YxEQB1_gcA&ccb=9-4&oh=00_AYDSXj-VqEbqmRax-CqaNaB5tC2FnUhKP6pETWp18qhsyg&oe=6765BC2D&_nc_sid=1d576d,https://www.instagram.com/reel/C8DOlsaBa1b/,https://scontent.cdninstagram.com/v/t51.29350-15/448223537_1143442173377984_7261999520271562477_n.jpg?stp=dst-jpg_e35_tt6&_nc_cat=104&ccb=1-7&_nc_sid=18de74&_nc_ohc=KSIAJn5tpTQQ7kNvgHcPAlq&_nc_oc=Adj44BMBM2fA_MzH328ScawQXPaiibN-r_2uGAGTznLLfCrlDyPsLcRMYpH6FtYVmjBil_5pIAdbaxAQHQuLr1JF&_nc_zt=23&_nc_ht=scontent.cdninstagram.com&edm=ANo9K5cEAAAA&_nc_gid=AnBqdYMzoXr8ZLMYvcndu7o&oh=00_AYCNO-Siv18XkdJdZ9b1GkRh3Ka4AP3xdYolD_IJrfwYzA&oe=6769B412,2024-06-10T21:40:19+0000
18048214048736972,"✨ Um Vislumbre do Duo MARFIM ✨

Confira algumas das fotos que @leoleoleomenezes tirou no recente ensaio fotográfico do @marfim.musica !
Este ensaio ficou incrível, capturando a harmonia e a cumplicidade que compartilhamos através da nossa arte. 

Em breve, lançaremos o making of, revelando os bastidores desse dia tão especial. Fiquem atentos!

Siga nossa página e acompanhe de perto todas as novidades do MARFIM! 🎶

#MARFIM #DuoMarfim #SãoCarlos #MúsicaContempoânea #DiversidadeCultural #musicaclassica #ufscar #saocarlos #cultura  #composers #projetocultural",CAROUSEL_ALBUM,https://scontent.cdninstagram.com/v/t51.29350-15/446508138_825475206135126_1084408630884834488_n.heic?stp=dst-jpg_e35_tt6&_nc_cat=105&ccb=1-7&_nc_sid=18de74&_nc_ohc=GQXk9kNpelAQ7kNvgFVKRCj&_nc_oc=AdhWjn2U9s7vDZy2wwOvcpqnixy1WY9j0Fmh4uDb8ykAINnDc9vHG7Qc1HsqjJwXK9TtrhQcW4KrQSxBJziVMKBa&_nc_zt=23&_nc_ht=scontent.cdninstagram.com&edm=ANo9K5cEAAAA&_nc_gid=AnBqdYMzoXr8ZLMYvcndu7o&oh=00_AYA-11jlD04jdZK5mSK9aSUJMiGiEST0EknWirw4sEw-Gw&oe=6769CEE7,https://www.instagram.com/p/C7cnn3MAI5Z/,,2024-05-26T21:42:41+0000
